{
  "schema_version": 1,
  "catalog_version": "2026.10.20.3",
  "observed_at": "2026-10-20T15:39:43.000Z",
  "sources": {
    "base": "https://blockrun.ai/api/v1/models?format=json",
    "solana": "https://sol.blockrun.ai/api/v1/models?format=json"
  },
  "models": [
    {
      "id": "anthropic/claude-fable-5",
      "name": "Claude Fable 5",
      "provider": "anthropic",
      "description": "Anthropic's most capable model — Mythos-class tier above Opus, for the most demanding reasoning and long-horizon agentic work. 1M context, 128K output, always-on thinking",
      "lifecycle": "active",
      "declared_capabilities": [
        "chat",
        "coding",
        "reasoning",
        "vision"
      ],
      "aliases": [],
      "redirects": [],
      "networks": {
        "base": {
          "listed": true,
          "categories": [
            "chat",
            "coding",
            "reasoning",
            "vision"
          ],
          "billing_mode": "paid",
          "pricing": {
            "input": 10,
            "output": 50,
            "cache_read": 1,
            "cache_write": 12.5
          },
          "context_window": 1000000,
          "max_output": 128000
        },
        "solana": {
          "listed": true,
          "categories": [
            "chat",
            "coding",
            "reasoning",
            "vision"
          ],
          "billing_mode": "paid",
          "pricing": {
            "input": 10,
            "output": 50
          },
          "context_window": 1000000,
          "max_output": 128000
        }
      }
    },
    {
      "id": "anthropic/claude-fable-5.1",
      "name": "Claude Fable 5.1",
      "provider": "anthropic",
      "description": "Anthropic's most capable model — successor to Fable 5 in the same tier at the same price, for the most demanding reasoning and long-horizon agentic work. 1M context, 128K output, always-on thinking",
      "lifecycle": "active",
      "declared_capabilities": [
        "chat",
        "coding",
        "reasoning",
        "vision"
      ],
      "aliases": [],
      "redirects": [],
      "networks": {
        "base": {
          "listed": true,
          "categories": [
            "chat",
            "coding",
            "reasoning",
            "vision"
          ],
          "billing_mode": "paid",
          "pricing": {
            "input": 10,
            "output": 50,
            "cache_read": 0.25,
            "cache_write": 12.5
          },
          "context_window": 1000000,
          "max_output": 128000
        },
        "solana": {
          "listed": true,
          "categories": [
            "chat",
            "coding",
            "reasoning",
            "vision"
          ],
          "billing_mode": "paid",
          "pricing": {
            "input": 10,
            "output": 50
          },
          "context_window": 1000000,
          "max_output": 128000
        }
      }
    },
    {
      "id": "anthropic/claude-haiku-4.5",
      "name": "Claude Haiku 4.5",
      "provider": "anthropic",
      "description": "Fastest and most efficient Claude, near-frontier intelligence",
      "lifecycle": "active",
      "declared_capabilities": [
        "chat",
        "coding",
        "vision"
      ],
      "aliases": [],
      "redirects": [],
      "networks": {
        "base": {
          "listed": true,
          "categories": [
            "chat",
            "coding",
            "vision"
          ],
          "billing_mode": "paid",
          "pricing": {
            "input": 1,
            "output": 5,
            "cache_read": 0.1,
            "cache_write": 1.25
          },
          "context_window": 200000,
          "max_output": 64000
        },
        "solana": {
          "listed": true,
          "categories": [
            "chat",
            "coding",
            "vision"
          ],
          "billing_mode": "paid",
          "pricing": {
            "input": 1,
            "output": 5
          },
          "context_window": 200000,
          "max_output": 64000
        }
      }
    },
    {
      "id": "anthropic/claude-opus-4.5",
      "name": "Claude Opus 4.5",
      "provider": "anthropic",
      "description": "Latest Anthropic flagship with enhanced reasoning and creativity",
      "lifecycle": "active",
      "declared_capabilities": [
        "chat",
        "coding",
        "reasoning",
        "vision"
      ],
      "aliases": [],
      "redirects": [],
      "networks": {
        "base": {
          "listed": true,
          "categories": [
            "chat",
            "coding",
            "reasoning",
            "vision"
          ],
          "billing_mode": "paid",
          "pricing": {
            "input": 5,
            "output": 25,
            "cache_read": 0.5,
            "cache_write": 6.25
          },
          "context_window": 200000,
          "max_output": 64000
        },
        "solana": {
          "listed": true,
          "categories": [
            "chat",
            "coding",
            "reasoning",
            "vision"
          ],
          "billing_mode": "paid",
          "pricing": {
            "input": 5,
            "output": 25
          },
          "context_window": 200000,
          "max_output": 64000
        }
      }
    },
    {
      "id": "anthropic/claude-opus-4.7",
      "name": "Claude Opus 4.7",
      "provider": "anthropic",
      "description": "Powerful Claude Opus for complex reasoning and agentic coding. 1M context, 128k output, adaptive thinking",
      "lifecycle": "active",
      "declared_capabilities": [
        "chat",
        "coding",
        "reasoning",
        "vision"
      ],
      "aliases": [],
      "redirects": [],
      "networks": {
        "base": {
          "listed": true,
          "categories": [
            "chat",
            "coding",
            "reasoning",
            "vision"
          ],
          "billing_mode": "paid",
          "pricing": {
            "input": 5,
            "output": 25,
            "cache_read": 0.5,
            "cache_write": 6.25
          },
          "context_window": 1000000,
          "max_output": 128000
        },
        "solana": {
          "listed": true,
          "categories": [
            "chat",
            "coding",
            "reasoning",
            "vision"
          ],
          "billing_mode": "paid",
          "pricing": {
            "input": 5,
            "output": 25
          },
          "context_window": 1000000,
          "max_output": 128000
        }
      }
    },
    {
      "id": "anthropic/claude-opus-4.8",
      "name": "Claude Opus 4.8",
      "provider": "anthropic",
      "description": "Most capable Claude 4-series Opus for complex reasoning and agentic coding. 1M context, 128k output, adaptive thinking",
      "lifecycle": "active",
      "declared_capabilities": [
        "chat",
        "coding",
        "reasoning",
        "vision"
      ],
      "aliases": [],
      "redirects": [],
      "networks": {
        "base": {
          "listed": true,
          "categories": [
            "chat",
            "coding",
            "reasoning",
            "vision"
          ],
          "billing_mode": "paid",
          "pricing": {
            "input": 5,
            "output": 25,
            "cache_read": 0.5,
            "cache_write": 6.25
          },
          "context_window": 1000000,
          "max_output": 128000
        },
        "solana": {
          "listed": true,
          "categories": [
            "chat",
            "coding",
            "reasoning",
            "vision"
          ],
          "billing_mode": "paid",
          "pricing": {
            "input": 5,
            "output": 25
          },
          "context_window": 1000000,
          "max_output": 128000
        }
      }
    },
    {
      "id": "anthropic/claude-opus-5",
      "name": "Claude Opus 5",
      "provider": "anthropic",
      "description": "Newest Opus — step-change over Opus 4.8 for deep reasoning and agentic coding at the same price. 1M context, 128k output, adaptive thinking",
      "lifecycle": "active",
      "declared_capabilities": [
        "chat",
        "coding",
        "reasoning",
        "vision"
      ],
      "aliases": [],
      "redirects": [],
      "networks": {
        "base": {
          "listed": true,
          "categories": [
            "chat",
            "coding",
            "reasoning",
            "vision"
          ],
          "billing_mode": "paid",
          "pricing": {
            "input": 5,
            "output": 25,
            "cache_read": 0.5,
            "cache_write": 6.25
          },
          "context_window": 1000000,
          "max_output": 128000
        },
        "solana": {
          "listed": true,
          "categories": [
            "chat",
            "coding",
            "reasoning",
            "vision"
          ],
          "billing_mode": "paid",
          "pricing": {
            "input": 5,
            "output": 25
          },
          "context_window": 1000000,
          "max_output": 128000
        }
      }
    },
    {
      "id": "anthropic/claude-opus-5.5",
      "name": "Claude Opus 5.5",
      "provider": "anthropic",
      "description": "Newest Opus — Opus-class deep reasoning and agentic coding at a lower price than Opus 5. 1M context, 128k output, always-on adaptive thinking, vision",
      "lifecycle": "active",
      "declared_capabilities": [
        "chat",
        "coding",
        "reasoning",
        "vision"
      ],
      "aliases": [],
      "redirects": [],
      "networks": {
        "base": {
          "listed": true,
          "categories": [
            "chat",
            "coding",
            "reasoning",
            "vision"
          ],
          "billing_mode": "paid",
          "pricing": {
            "input": 4,
            "output": 20,
            "cache_read": 0.2,
            "cache_write": 5